{
  "$schema": "./schemas/prophecy-clue-ladder.schema.json",
  "game": "prophecy-clue-ladder",
  "version": 1,
  "displayName": "Prophecy Clue Ladder",
  "roundsPerSession": 5,
  "sessions": [
    {
      "id": "pcl-session-01",
      "title": "Prophecy Clue Ladder Set 01",
      "theme": "Five-clue prophecy identification rounds",
      "rounds": [
        {
          "id": "pcl-001",
          "title": "Seed Of The Woman",
          "theme": "Victory",
          "answer": "Christ's victory over sin and death",
          "acceptedAnswers": [
            "Christ's victory over sin and death",
            "Seed Of The Woman",
            "Genesis 3:15",
            "Hebrews 2:14"
          ],
          "reference": "Genesis 3:15",
          "fulfillmentReference": "Hebrews 2:14",
          "clues": [
            "This prophecy belongs to the victory theme.",
            "The Old Testament reference is Genesis 3:15.",
            "The wording includes: \"It shall bruise thy head, and thou shalt bruise his heel.\"",
            "A New Testament connection appears at Hebrews 2:14.",
            "The fulfillment wording includes: \"That through death he might destroy him that had the power of death.\""
          ],
          "difficulty": "medium",
          "teachingNote": "This is commonly read by Christian interpreters as an early promise of victory over evil."
        },
        {
          "id": "pcl-002",
          "title": "Blessing To All Nations",
          "theme": "Nations",
          "answer": "Blessing to the nations",
          "acceptedAnswers": [
            "Blessing to the nations",
            "Blessing To All Nations",
            "Genesis 12:3",
            "Galatians 3:8"
          ],
          "reference": "Genesis 12:3",
          "fulfillmentReference": "Galatians 3:8",
          "clues": [
            "This prophecy belongs to the nations theme.",
            "The Old Testament reference is Genesis 12:3.",
            "The wording includes: \"In thee shall all families of the earth be blessed.\"",
            "A New Testament connection appears at Galatians 3:8.",
            "The fulfillment wording includes: \"In thee shall all nations be blessed.\""
          ],
          "difficulty": "easy",
          "teachingNote": "The New Testament explicitly applies this Abraham promise to the gospel going to the nations."
        },
        {
          "id": "pcl-003",
          "title": "Ruler From Judah",
          "theme": "Kingship",
          "answer": "Comes from Judah",
          "acceptedAnswers": [
            "Comes from Judah",
            "Ruler From Judah",
            "Genesis 49:10",
            "Hebrews 7:14"
          ],
          "reference": "Genesis 49:10",
          "fulfillmentReference": "Hebrews 7:14",
          "clues": [
            "This prophecy belongs to the kingship theme.",
            "The Old Testament reference is Genesis 49:10.",
            "The wording includes: \"The sceptre shall not depart from Judah.\"",
            "A New Testament connection appears at Hebrews 7:14.",
            "The fulfillment wording includes: \"Our Lord sprang out of Juda.\""
          ],
          "difficulty": "easy",
          "teachingNote": "The Judah connection is a widely recognized messianic theme."
        },
        {
          "id": "pcl-004",
          "title": "Prophet Like Moses",
          "theme": "Prophet",
          "answer": "Prophet like Moses",
          "acceptedAnswers": [
            "Prophet like Moses",
            "Prophet Like Moses",
            "Deuteronomy 18:15",
            "Acts 3:22"
          ],
          "reference": "Deuteronomy 18:15",
          "fulfillmentReference": "Acts 3:22",
          "clues": [
            "This prophecy belongs to the prophet theme.",
            "The Old Testament reference is Deuteronomy 18:15.",
            "The wording includes: \"The Lord thy God will raise up unto thee a Prophet.\"",
            "A New Testament connection appears at Acts 3:22.",
            "The fulfillment wording includes: \"A prophet shall the Lord your God raise up unto you.\""
          ],
          "difficulty": "medium",
          "teachingNote": "Acts gives this passage a direct place in apostolic preaching about Jesus."
        },
        {
          "id": "pcl-005",
          "title": "Son And King",
          "theme": "Kingship",
          "answer": "God's Son and anointed King",
          "acceptedAnswers": [
            "God's Son and anointed King",
            "Son And King",
            "Psalm 2:7",
            "Acts 13:33"
          ],
          "reference": "Psalm 2:7",
          "fulfillmentReference": "Acts 13:33",
          "clues": [
            "This prophecy belongs to the kingship theme.",
            "The Old Testament reference is Psalm 2:7.",
            "The wording includes: \"Thou art my Son; this day have I begotten thee.\"",
            "A New Testament connection appears at Acts 13:33.",
            "The fulfillment wording includes: \"Thou art my Son, this day have I begotten thee.\""
          ],
          "difficulty": "medium",
          "teachingNote": "Psalm 2 is used in the New Testament to speak of the Messiah's sonship and reign."
        }
      ]
    },
    {
      "id": "pcl-session-02",
      "title": "Prophecy Clue Ladder Set 02",
      "theme": "Five-clue prophecy identification rounds",
      "rounds": [
        {
          "id": "pcl-006",
          "title": "Not Seeing Corruption",
          "theme": "Resurrection",
          "answer": "Resurrection without seeing corruption",
          "acceptedAnswers": [
            "Resurrection without seeing corruption",
            "Not Seeing Corruption",
            "Psalm 16:10",
            "Acts 2:31"
          ],
          "reference": "Psalm 16:10",
          "fulfillmentReference": "Acts 2:31",
          "clues": [
            "This prophecy belongs to the resurrection theme.",
            "The Old Testament reference is Psalm 16:10.",
            "The wording includes: \"Neither wilt thou suffer thine Holy One to see corruption.\"",
            "A New Testament connection appears at Acts 2:31.",
            "The fulfillment wording includes: \"His soul was not left in hell, neither his flesh did see corruption.\""
          ],
          "difficulty": "easy",
          "teachingNote": "Acts 2 directly connects Psalm 16 with the resurrection of Jesus."
        },
        {
          "id": "pcl-007",
          "title": "Suffering Cry",
          "theme": "Suffering",
          "answer": "Jesus' suffering cry from the cross",
          "acceptedAnswers": [
            "Jesus' suffering cry from the cross",
            "Suffering Cry",
            "Psalm 22:1",
            "Matthew 27:46"
          ],
          "reference": "Psalm 22:1",
          "fulfillmentReference": "Matthew 27:46",
          "clues": [
            "This prophecy belongs to the suffering theme.",
            "The Old Testament reference is Psalm 22:1.",
            "The wording includes: \"My God, my God, why hast thou forsaken me?\"",
            "A New Testament connection appears at Matthew 27:46.",
            "The fulfillment wording includes: \"My God, my God, why hast thou forsaken me?\""
          ],
          "difficulty": "easy",
          "teachingNote": "The Gospel records Jesus using Psalm 22 language during the crucifixion."
        },
        {
          "id": "pcl-008",
          "title": "Garments Divided",
          "theme": "Suffering",
          "answer": "Garments divided",
          "acceptedAnswers": [
            "Garments divided",
            "Garments Divided",
            "Psalm 22:18",
            "John 19:24"
          ],
          "reference": "Psalm 22:18",
          "fulfillmentReference": "John 19:24",
          "clues": [
            "This prophecy belongs to the suffering theme.",
            "The Old Testament reference is Psalm 22:18.",
            "The wording includes: \"They part my garments among them, and cast lots upon my vesture.\"",
            "A New Testament connection appears at John 19:24.",
            "The fulfillment wording includes: \"They said therefore among themselves, Let us not rend it, but cast lots for it.\""
          ],
          "difficulty": "easy",
          "teachingNote": "John explicitly cites the casting of lots as fulfillment of scripture."
        },
        {
          "id": "pcl-009",
          "title": "Bones Not Broken",
          "theme": "Suffering",
          "answer": "No bones broken",
          "acceptedAnswers": [
            "No bones broken",
            "Bones Not Broken",
            "Psalm 34:20",
            "John 19:36"
          ],
          "reference": "Psalm 34:20",
          "fulfillmentReference": "John 19:36",
          "clues": [
            "This prophecy belongs to the suffering theme.",
            "The Old Testament reference is Psalm 34:20.",
            "The wording includes: \"He keepeth all his bones: not one of them is broken.\"",
            "A New Testament connection appears at John 19:36.",
            "The fulfillment wording includes: \"A bone of him shall not be broken.\""
          ],
          "difficulty": "easy",
          "teachingNote": "John cites this detail while describing Jesus' death."
        },
        {
          "id": "pcl-010",
          "title": "Betrayed By A Friend",
          "theme": "Betrayal",
          "answer": "Betrayed by a familiar friend",
          "acceptedAnswers": [
            "Betrayed by a familiar friend",
            "Betrayed By A Friend",
            "Psalm 41:9",
            "John 13:18"
          ],
          "reference": "Psalm 41:9",
          "fulfillmentReference": "John 13:18",
          "clues": [
            "This prophecy belongs to the betrayal theme.",
            "The Old Testament reference is Psalm 41:9.",